{
  "$schema": "./secrets.manifest.schema.json",
  "description": "Canonical registry of secret/config NAMES and their fan-out target mapping. NAMES AND TARGETS ONLY — never values. The single source of values is the gitignored local .env. `secrets-fanout.mjs` reads this manifest + .env and propagates values to each listed target. App-runtime secrets are the fan-out payload; operator-lane credentials authenticate the fan-out itself and are NEVER fanned into the app env (targets: []).",
  "targets": {
    "vercel": "Vercel project env (app + REST + MCP on one domain). Production + Preview + Development.",
    "github": "GitHub Actions repository secrets (JamiStudio/intercal) consumed by pipeline.yml / CD workflows.",
    "cloudrun": "Cloud Run service/job env (heavy/on-demand pipeline + MCP fallback). Deferred until a Cloud Run service exists (Plan 07 W4)."
  },
  "vercelTargets": ["production", "preview", "development"],
  "secrets": [
    {
      "name": "DATABASE_URL",
      "lane": "app-runtime",
      "targets": ["vercel", "github", "cloudrun"],
      "note": "Neon pooled connection string (app + pipeline)."
    },
    {
      "name": "DATABASE_URL_UNPOOLED",
      "lane": "app-runtime",
      "targets": ["vercel", "github", "cloudrun"],
      "note": "Neon direct connection (migrations / long jobs)."
    },

    {
      "name": "STORAGE_PROVIDER",
      "lane": "app-runtime",
      "targets": ["github", "cloudrun"],
      "note": "Object-storage adapter selector (s3)."
    },
    {
      "name": "S3_ENDPOINT",
      "lane": "app-runtime",
      "targets": ["github", "cloudrun"],
      "note": "R2/S3 endpoint."
    },
    { "name": "S3_REGION", "lane": "app-runtime", "targets": ["github", "cloudrun"] },
    { "name": "S3_BUCKET", "lane": "app-runtime", "targets": ["github", "cloudrun"] },
    { "name": "S3_ACCESS_KEY_ID", "lane": "app-runtime", "targets": ["github", "cloudrun"] },
    { "name": "S3_SECRET_ACCESS_KEY", "lane": "app-runtime", "targets": ["github", "cloudrun"] },
    { "name": "S3_FORCE_PATH_STYLE", "lane": "app-runtime", "targets": ["github", "cloudrun"] },

    {
      "name": "QUEUE_PROVIDER",
      "lane": "app-runtime",
      "targets": ["github", "cloudrun"],
      "note": "Queue/cache adapter selector (redis|postgres)."
    },
    {
      "name": "REDIS_URL",
      "lane": "app-runtime",
      "targets": ["github", "cloudrun"],
      "note": "Upstash redis:// URL."
    },
    {
      "name": "UPSTASH_REDIS_REST_URL",
      "lane": "app-runtime",
      "targets": ["github", "cloudrun"],
      "note": "Upstash REST endpoint (REST adapter path)."
    },
    {
      "name": "UPSTASH_REDIS_REST_TOKEN",
      "lane": "app-runtime",
      "targets": ["github", "cloudrun"]
    },

    {
      "name": "EMBEDDINGS_PROVIDER",
      "lane": "app-runtime",
      "targets": ["github", "cloudrun"],
      "note": "local fastembed by default (zero cost)."
    },
    { "name": "EMBEDDINGS_MODEL", "lane": "app-runtime", "targets": ["github", "cloudrun"] },
    { "name": "EMBEDDINGS_DIM", "lane": "app-runtime", "targets": ["github", "cloudrun"] },

    {
      "name": "LLM_PROVIDER",
      "lane": "app-runtime",
      "targets": ["github", "cloudrun"],
      "note": "vertex primary -> gemini fallback."
    },
    { "name": "LLM_MODEL", "lane": "app-runtime", "targets": ["github", "cloudrun"] },
    {
      "name": "GEMINI_API_KEY",
      "lane": "app-runtime",
      "targets": ["github", "cloudrun"],
      "note": "Gemini postpay fallback key."
    },
    {
      "name": "GROQ_API_KEY",
      "lane": "app-runtime",
      "targets": ["github", "cloudrun"],
      "optional": true
    },
    {
      "name": "ANTHROPIC_API_KEY",
      "lane": "app-runtime",
      "targets": ["github", "cloudrun"],
      "optional": true
    },
    {
      "name": "OPENAI_API_KEY",
      "lane": "app-runtime",
      "targets": ["github", "cloudrun"],
      "optional": true
    },

    {
      "name": "GCLOUD_PROJECT_ID",
      "lane": "app-runtime",
      "targets": ["github", "cloudrun"],
      "note": "Vertex project id (also used as VERTEX_PROJECT fallback)."
    },
    {
      "name": "GOOGLE_SERVICE_ACCOUNT_KEY",
      "lane": "app-runtime",
      "targets": ["github", "cloudrun"],
      "optional": true,
      "note": "Path/inline SA JSON for Vertex ADC in the pipeline runtime. NOTE: in CI this is provided as GCP_SA_KEY material; manifest tracks the runtime name only."
    },

    {
      "name": "SCHEDULER_PROVIDER",
      "lane": "app-runtime",
      "targets": ["github", "cloudrun"],
      "optional": true
    },
    {
      "name": "PUBLIC_API_BASE_URL",
      "lane": "app-runtime",
      "targets": ["vercel", "cloudrun"],
      "note": "Public base URL the SDK/dashboard call."
    },
    {
      "name": "LOG_LEVEL",
      "lane": "app-runtime",
      "targets": ["vercel", "github", "cloudrun"],
      "optional": true
    },
    {
      "name": "SENTRY_DSN",
      "lane": "app-runtime",
      "targets": ["vercel", "github", "cloudrun"],
      "optional": true
    },

    {
      "name": "INGEST_CRON",
      "lane": "app-runtime",
      "targets": ["github", "cloudrun"],
      "optional": true,
      "note": "Pipeline cadence; defaults in code if unset (resource-budget.md)."
    },
    {
      "name": "INGEST_MAX_DOCS_PER_RUN",
      "lane": "app-runtime",
      "targets": ["github", "cloudrun"],
      "optional": true
    },
    {
      "name": "EXTRACT_ONLY_CHANGED",
      "lane": "app-runtime",
      "targets": ["github", "cloudrun"],
      "optional": true
    },
    {
      "name": "LLM_DAILY_REQUEST_BUDGET",
      "lane": "app-runtime",
      "targets": ["github", "cloudrun"],
      "optional": true
    },
    {
      "name": "LLM_MAX_OUTPUT_TOKENS",
      "lane": "app-runtime",
      "targets": ["github", "cloudrun"],
      "optional": true
    },
    {
      "name": "LLM_PRIMARY",
      "lane": "app-runtime",
      "targets": ["github", "cloudrun"],
      "optional": true
    },
    {
      "name": "EMBEDDINGS_BATCH_SIZE",
      "lane": "app-runtime",
      "targets": ["github", "cloudrun"],
      "optional": true
    },

    {
      "name": "VERCEL_TOKEN",
      "lane": "operator",
      "targets": [],
      "note": "Authenticates the Vercel fan-out itself. NEVER fanned into app env."
    },
    {
      "name": "VERCEL_PROJECT_ID",
      "lane": "operator",
      "targets": [],
      "note": "Vercel project id used by the fan-out script."
    },
    { "name": "VERCEL_TEAM_ID", "lane": "operator", "targets": [] },
    { "name": "VERCEL_TEAM_SLUG", "lane": "operator", "targets": [] },
    { "name": "VERCEL_USER_ID", "lane": "operator", "targets": [] },
    { "name": "VERCEL_DOMAIN", "lane": "operator", "targets": [], "optional": true },

    {
      "name": "GITHUB_REPO",
      "lane": "operator",
      "targets": [],
      "note": "owner/repo for `gh secret set`; the fan-out reads this, gh auth (PAT) authenticates."
    },
    {
      "name": "GITHUB_TOKEN",
      "lane": "operator",
      "targets": [],
      "optional": true,
      "note": "Optional gh PAT override; gh CLI keyring auth used otherwise. Source-adapter read token, NOT a runtime payload."
    },

    {
      "name": "GCP_SA_KEY",
      "lane": "operator",
      "targets": [],
      "optional": true,
      "note": "Service-account JSON used by CI to authenticate to GCloud (Cloud Run deploy). Already set as a GitHub secret manually; the script does not re-fan it."
    },
    {
      "name": "GCLOUD_REGION",
      "lane": "operator",
      "targets": [],
      "optional": true,
      "note": "Region the fan-out's `gcloud run services update` targets (operator-lane, read from .env directly). NOT an app-runtime payload: the runtime Vertex region comes from VERTEX_LOCATION (config.py), and no app code reads GCLOUD_REGION."
    },

    {
      "name": "NEON_API_KEY",
      "lane": "operator",
      "targets": [],
      "optional": true,
      "note": "Neon control-plane API (branching/backups). Operator-only."
    },
    { "name": "NEON_PROJECT_ID", "lane": "operator", "targets": [], "optional": true },
    { "name": "NEON_AUTH_URL", "lane": "operator", "targets": [], "optional": true },
    { "name": "NEON_AUTH_JWKS_URL", "lane": "operator", "targets": [], "optional": true },
    { "name": "NEON_DATA_API_URL", "lane": "operator", "targets": [], "optional": true },

    {
      "name": "CLOUDFLARE_API_TOKEN",
      "lane": "operator",
      "targets": [],
      "optional": true,
      "note": "Cloudflare control-plane (R2 bucket admin). Operator-only; runtime uses S3_* keys."
    },
    { "name": "CLOUDFLARE_ACCOUNT_ID", "lane": "operator", "targets": [], "optional": true }
  ]
}
